{
  "format": "salidium.session-list",
  "version": 1,
  "generatedAt": "2026-09-20T16:20:00.000Z",
  "sessions": [
    {
      "id": "claude-code:b27e5d10-8c4f-4a63-9e1d-3f5a7c9b2e84",
      "native": {
        "provider": "claude-code",
        "sessionId": "b27e5d10-8c4f-4a63-9e1d-3f5a7c9b2e84"
      },
      "title": null,
      "cwd": "/Users/dev/acme/search",
      "repositoryRoot": null,
      "model": "claude-opus-5",
      "status": "working",
      "startedAt": "2026-09-20T16:14:00.000Z",
      "lastEventAt": "2026-09-20T16:14:07.000Z",
      "endedAt": null,
      "evidenceSeq": 2,
      "counts": {
        "turns": 1,
        "toolCalls": 1,
        "filesChanged": 0,
        "linesAdded": 0,
        "linesRemoved": 0,
        "linesRemovedExact": true,
        "reviewOpen": 0,
        "remaining": 0
      },
      "lastVerification": null,
      "explanation": "disabled"
    },
    {
      "id": "codex:0199a3f2-7c4e-7b10-8d2a-5e6f9c1b3a47",
      "native": {
        "provider": "codex",
        "sessionId": "0199a3f2-7c4e-7b10-8d2a-5e6f9c1b3a47"
      },
      "title": null,
      "cwd": "/Users/dev/acme/images",
      "repositoryRoot": null,
      "model": "gpt-5.5-codex",
      "status": "waiting",
      "startedAt": "2026-09-20T16:05:00.000Z",
      "lastEventAt": "2026-09-20T16:05:25.000Z",
      "endedAt": null,
      "evidenceSeq": 7,
      "counts": {
        "turns": 1,
        "toolCalls": 2,
        "filesChanged": 1,
        "linesAdded": 12,
        "linesRemoved": 4,
        "linesRemovedExact": true,
        "reviewOpen": 2,
        "remaining": 0
      },
      "lastVerification": {
        "outcome": "fail",
        "at": "2026-09-20T16:05:20.000Z",
        "provenance": "observed"
      },
      "explanation": "disabled"
    },
    {
      "id": "claude-code:6f1c2a90-3b7e-4d15-9a2c-0e8b5d7f4c11",
      "native": {
        "provider": "claude-code",
        "sessionId": "6f1c2a90-3b7e-4d15-9a2c-0e8b5d7f4c11"
      },
      "title": "Fix double charge on retry",
      "cwd": "/Users/dev/acme/checkout",
      "repositoryRoot": "/Users/dev/acme/checkout",
      "model": "claude-opus-5",
      "status": "ended",
      "startedAt": "2026-09-20T15:40:00.000Z",
      "lastEventAt": "2026-09-20T15:41:35.000Z",
      "endedAt": "2026-09-20T15:41:30.000Z",
      "evidenceSeq": 26,
      "counts": {
        "turns": 1,
        "toolCalls": 7,
        "filesChanged": 5,
        "linesAdded": 46,
        "linesRemoved": 6,
        "linesRemovedExact": true,
        "reviewOpen": 2,
        "remaining": 1
      },
      "lastVerification": {
        "outcome": "pass",
        "at": "2026-09-20T15:40:50.000Z",
        "provenance": "observed"
      },
      "explanation": "generated"
    }
  ],
  "total": 3,
  "truncated": false
}
